{
  "$schema": "https://json-schema.org/draft/2020-12/schema",
  "$id": "https://verityspec.org/schemas/v0.1/game-assets/game-visual-identity.schema.json",
  "title": "Game Visual Identity",
  "type": "object",
  "additionalProperties": false,
  "required": [
    "id",
    "kind",
    "name",
    "status",
    "owner",
    "description",
    "tone",
    "artDirection",
    "styleKeywords",
    "references"
  ],
  "properties": {
    "id": {
      "type": "string",
      "pattern": "^[a-z][a-z0-9]*(?:[._-][a-z0-9]+)*$"
    },
    "kind": {
      "type": "string",
      "const": "game.visual-identity"
    },
    "name": {
      "type": "string",
      "minLength": 1
    },
    "description": {
      "type": "string",
      "minLength": 1
    },
    "status": {
      "type": "string",
      "enum": ["draft", "review", "ready", "deprecated", "removed"]
    },
    "owner": {
      "type": "string",
      "minLength": 1
    },
    "tone": {
      "type": "string",
      "minLength": 1
    },
    "artDirection": {
      "type": "string",
      "minLength": 1
    },
    "styleKeywords": {
      "type": "array",
      "minItems": 1,
      "items": {
        "type": "string",
        "minLength": 1
      }
    },
    "palette": {
      "type": "array",
      "items": {
        "type": "string",
        "minLength": 1
      },
      "default": []
    },
    "references": {
      "type": "array",
      "items": {
        "type": "object",
        "additionalProperties": false,
        "required": ["type", "target"],
        "properties": {
          "type": {
            "type": "string",
            "minLength": 1
          },
          "target": {
            "type": "string",
            "minLength": 1
          },
          "required": {
            "type": "boolean",
            "default": true
          }
        }
      },
      "default": []
    }
  }
}
